2008JS,問題文,選択肢,,,,
1,10進数の「33」を2進数で表したのはどれか。解答記入欄( 1 )にマークしなさい。,100001,100011,100101,110001,110011
2,x、yをそれぞれ2進1桁の数とする。その和は2進数でabと表される。このとき、aとbを求めるための論理式はどれか。解答記入欄( 2 )にマークしなさい。,"""a = x AND y , b = x OR y""","""a = x AND y , b = x XOR y""","""a = x OR y , b = x AND y""","""a = x OR y , b = x XOR y""","""a = x XOR y , b = x OR y"""
3,英語、日本語、中国語など多言語に対応した文字集合を表現する規格はどれか。解答記入欄( 3 )にマークしなさい。,EUC-JP,ISO646,Shift-JIS,ASCII,Unicode
4,コンピュータを構成する装置のうち、主記憶装置に置かれたプログラムを解読し、他の装置に指示を出す装置はどれか。解答記入欄( 4 )にマークしなさい。,記憶装置,制御装置,演算装置,入力装置,出力装置
5,以下の文の(　)に当てはまる単語を語群から選び、解答記入欄( 5 )~( 6 )にマークしなさい。,"""( 5 )1,( 6 )5""","""( 5 )2,( 6 )6""","""( 5 )3,( 6 )7""","""( 5 )4,( 6 )8""","""( 5 )4,( 6 )7"""
6,以下の文の(　)に当てはまる単語を語群から選び、解答記入欄( 7 )~( 10 )にマークしなさい。,"""( 7 )1,( 8 )5,( 9 )2,( 10 )9""","""( 7 )2,( 8 )6,( 9 )1,( 10 )8""","""( 7 )3,( 8 )7,( 9 )3,( 10 )10""","""( 7 )2,( 8 )6,( 9 )2,( 10 )9""","""( 7 )4,( 8 )5,( 9 )1,( 10 )10"""
7,ハードディスクに関する記述として誤っているのはどれか。解答記入欄( 11 )にマークしなさい。,電源が切れても記録内容は保持される。,トラックとセクタという単位で管理される。,磁気へッドは記録面に接触している。,フラグメンテーションが発生することがある。,物理フォーマットと論理フォーマットがある。
8,オペレーティングシステムの役割でないのはどれか。解答記入欄( 12 )にマークしなさい。,電源の管理,周辺装置の制御,データベース管理,ネットワークのサポート,ユーザインタフェースの提供
9,プログラミング言語でないのはどれか。解答記入欄( 13 )にマークしなさい。,C,CGI,PHP,Java,Perl
10,以下は1から10の整数の和を求めるフローチャートである。フローチャート中の(　)に入れるべき式を語群から選び、解答記入欄( 14 )~( 16 )にマークしなさい。←は代入、i、xは変数、<、>は比較演算子を表す。,"""( 14 )1,( 15 )5,( 16 )7""","""( 14 )2,( 15 )6,( 16 )8""","""( 14 )3,( 15 )5,( 16 )7""","""( 14 )4,( 15 )6,( 16 )8""","""( 14 )2,( 15 )5,( 16 )7"""
11,静止画像・動画像のデータ形式でないのはどれか。解答記入欄( 17 )にマークしなさい。,AVI,BMP,MP3,MPEG,TIFF
12,無線LANに関する記述として誤っているのはどれか。解答記入欄( 18 )にマークしなさい。,最大伝送速度が異なる規格がある。,WEPやWPAなどの暗号化方式がある。,すべての規格は同じ周波数帯を利用する。,アクセスポイントにはESS-IDが設定される。,IEEE802.11gの最大伝送速度は54Mbpsである。
13,OSI参照モデルに関する記述として適切なのはどれか。解答記入欄( 19 )にマークしなさい。,HTTPはアプリケーション層である。,データリンク層がもっとも上位の階層である。,MACアドレスは物理層で用いるアドレスである。,各プロトコルが成立した時代ごとに整理したものである。,上位のプロトコルの通信内容は使用する下位のプロトコルによって変える必要がある。
14,TCP/IPモデルのアプリケーション層に該当するプロトコルのうち、誤っているのはどれか。解答記入欄( 20 )にマークしなさい。,ARP,FTP,POP3,HTTP,SNMP
15,ネットワークケーブルに関する記述として誤っているのはどれか。解答記入欄( 21 )にマークしなさい。,UTPはSTPより電磁ノイズに強い。,100BASE-TXは配線距離100メートル以内で用いる。,クロスケーブルを用いると2台のPCで直接通信ができる。,光ファイバ・ケーブルにはシングルモードとマルチモードがある。,UTPはSTPより電磁ノイズに強い。100BASE-TXは配線距離100メートル以内で用いる。クロスケーブルを用いると2台のPCで直接通信ができる。光ファイバ・ケーブルにはシングルモードとマルチモードがある。エンハンスドカテゴリ5のUTPで1000BASE-Tが実現できる。
16,IPアドレスが192.168.1.62で、サプネットマスクが255.255.255.128のとき、正しいネットワークアドレスはどれか。解答記入欄( 22 )にマークしなさい。,192.168.1.0,192.168.1.32,192.168.1.64,192.168.1.128,192.168.1.255
17,IPヘッダに含まれない情報はどれか。解答記入欄( 23 )にマークしなさい。,TTL,パケット長,プロトコル番号,宛先ポート番号,送信元IPアドレス
18,プライベートIPアドレスとNATに関する記述として適切なのはどれか。解答記入欄( 24 )にマークしなさい。,NATを用いるとファイアウォールを導入する必要はない。,プライベートIPアドレスを使うにはJPNICに申請が必要である。,プライベートIPアドレスは192.168で始めると決められている。,NATはプライベートIPアドレスからインターネット接続を行う際に利用される。,IPマスカレードはプライベートIPアドレスとグローバルIPアドレスを1対1に変換する。
19,DHCPでクライアントに割り当て可能なのはどれか。解答記入欄( 25 )にマークしなさい。,パスワード,通信帯域幅,MACアドレス,サブネットマスク,現在時刻
20,以下の文の(　)に当てはまる単語を語群から選び、解答記入欄( 26 )~( 27 )にマークしなさい。,"""( 26 )1,( 27 )7""","""( 26 )2,( 27 )8""","""( 26 )3,( 27 )5""","""( 26 )4,( 27 )6""","""( 26 )2,( 27 )6"""
21,XMLに関する記述として誤っているのはどれか。解答記入欄( 28 )にマークしなさい。,DTDが別途必要である。,手続き型のプログラム言語である。,構造化文書を記述する言語である。,Extensible Markup Languageの略である。,HTMLをXML準拠にしたものがXHTMLである。
22,インターネット上に構築された、あたかも専用線のようにみなせるネットワークはどれか。解答記入欄( 29 )にマークしなさい。,CATV,DHCP,VLAN,VPN,VRML
23,ファイアウォールに関係する記述として誤っているのはどれか。解答記入欄( 30 )にマークしなさい。,通信の記録を残すことができる。,パケットフィルタリング型は高速な処理を期待できる。,クライアントのセキュリティに関するメンテナンスは不要である。,サービス提供とセキュリティ確保を両立するためにDMZを作る。,アプリケーションゲートウェイ型ではアプリケーション毎の設定ができる。
24,データベースに関する記述として誤っているのはどれか。解答記入欄( 31 )にマークしなさい。,概念データモデルの1つをERモデルと呼ぶ。,一連の操作のかたまりをトランザクションと呼ぶ。,実世界の関係を記述したものを内部スキーマと呼ぶ。,データベースの操作・管理ソフトウェアをDBMSと呼ぶ。,関連性の強い項目を集め冗長性を排除することを正規化と呼ぶ。
25,関係データベースの正規化の目的として誤っているのはどれか。解答記入欄( 32 )にマークしなさい。,表の数を減らす。,重複を少なくする。,整合性を維持しやすくする。,関連性のある属性を集約する。,属性間の依存関係を小さくする。
26,以下の患者負担表に対して、次のSQL文で得られる表のデータの行数はどれか。解答記入欄( 33 )にマークしなさい。,2行,3行,4行,5行,12行
27,削除,,,,,
28,トランザクション処理がもつ特性でないのはどれか。解答記入欄( 35 )にマークしなさい。,隔離性,可用性,原子性,整合性,耐久性
29,複数のデータベース利用者が同時に同じデータを更新した場合に、論理的矛盾を生じさせないようにする仕組みはどれか。解答記入欄( 36 )にマークしなさい。,正規化,コミット,再編成,排他制御,ロールバック
30,データベースの運用上、ユーザからの要求処理を適切な応答時間でサービスするために必要な点検・監視項目として関係ないのはどれか。解答記入欄( 37 )にマークしなさい。,ヒット率,ホップ数,入出力回数,ロック待ち数,ページング数
31,セキュリティ対策として適切でないのはどれか。解答記入欄( 38 )にマークしなさい。,通信を暗号化する。,ファイアウォールを利用する。,ログファイルを定期的に点検する。,ユーザごとにアクセス権を設定する。,パスワードをグループ内で共有する。
32,情報セキュリティ特性の用語と説明について、正しい組み合わせはどれか。解答記入欄( 39 )にマークしなさい。,完全性 ― 情報の改竄(かいざん)が防止されていること。,真正性 ― 必要な期間内、復元可能な状態にしておくこと。,機密性 ― 許可されたものだけが情報にアクセスできること。,可用性 ― 情報の処理方法が正確に保たれていること。,保存性 ― 許可されたとき、確実に情報にアクセスできること。
33,2種類の鍵を用いる暗号方式はどれか。解答記入欄( 40 )にマークしなさい。,AES,DES,MD2,RSA,WEP
34,公開鍵暗号方式に関する記述として誤っているのはどれか。解答記入欄( 41 )にマークしなさい。,非対称暗号方式ともいう。,2種類の異なる鍵が利用される。,共通鍵方式に比べ処理速度が遅い。,公開鍵暗号アルゴリズムにはSSHがある。,共通鍵方式に比べ鍵の管理が容易となる。
35,本人確認のための認証技術でないのはどれか。解答記入欄( 42 )にマークしなさい。,生体認証方式,IDパスワード方式,デジタル署名方式,ワンタイムパスワード方式,チャレンジ＆レスポンス認証方式
36,安全な電子メール交換のための、改竄(かいざん)防止と暗号化の仕組みはどれか。解答記入欄( 43 )にマークしなさい。,IMAP,POP3,PPP,SMTP,S/MIME
37,削除,,,,,
38,以下の文の(　)に当てはまる単語の正しい組み合わせはどれか。解答記入欄( 45 )にマークしなさい。,①分析、②外部、③内部、④システム,①設定、②内部、③システム、④単体,①分析、②内部、③外部、④システム,①分析、②外部、③内部、④単体,①設定、②外部、③内部、④単体
39,以下のDFDの(A)に入れるべきもっとも適切な語句はどれか。解答記入欄( 46 )にマークしなさい。,オーダ番号,診療科名,主治医コード,患者ID,受診日
40,以下のERDに関する記述として誤っているのはどれか。解答記入欄( 47 )にマークしなさい。,科コード、科名は科の属性である。,患者ID、患者氏名は患者の属性である。,1つの科に複数の患者が受診することがある。,1人の患者は複数の科を受診することはできない。,患者と科の間には受診という関係があり、受診は受診日という属性を持つ。
41,以下のクリティカルバス上の最長作業の所要時間を50%短縮した。その結果、新たなクリティカルパスの作業全体に要する時間はいくらになるか。解答記入欄( 48 )にマークしなさい。,12,13,14,15,16
42,日程計画においてPERTを用いることによってわかることはどれか。解答記入欄( 49 )にマークしなさい。,どの作業を省略できるかがわかる。,どの作業に何人の人員が必要かがわかる。,どの作業が遅れると全体に影響を与えるかがわかる。,大切な作業を忘れていないかを事前に見つけることができる。,時間経過にともなって各工程にどの作業が割り当てられているかがわかる。
43,情報システムの保守管理に関する記述として誤っているのはどれか。解答記入欄( 50 )にマークしなさい。,障害が発生したときだけ行う。,障害の発生を予防するために行う。,日常的に見回って点検確認を行う。,保守作業は手順を決めて実施する。,あらかじめ設定したサイクルで正常稼動を確認する。
44,サーバ室の環境に関して優先度のもっとも低いのはどれか。解答記入欄( 51 )にマークしなさい。,防音対策を施す。,漏水検知器を設置する。,無停電電源装置を設置する。,室内温度を適温に保持する。,空調に防塵フィルタを用いる。
45,障害対策を表す用語として誤っているのはどれか。解答記入欄( 52 )にマークしなさい。,ホットプラグ,フェイルセーフ,フールプルーフ,ホットスタンバイ,フォールトトレランス
46,物理容量が250ギガバイトのハードディスク4台でRAID5を構成した。このとき全体の実効容量は最大何ギガバイトになるか。解答記入欄( 53 )にマークしなさい。,200ギガバイト,500ギガバイト,666ギガバイト,750ギガバイト,1000ギガバイト
47,システムの安全性を確保するセキュリティ管理に関する記述として正しいのはどれか。解答記入欄( 54 )にマークしなさい。,データを2つの独立なディスク装置に保管することは物理的セキュリティに分類される。,バックアップテープを耐火金庫に保管することは物理的セキュリティに分類される。,個人認証システムの導入は管理的セキュリティに分類される。,障害対策マニュアルの整備は組織的セキュリティに分類される。,遠隔地バックアップ施設は技術的セキュリティ対策に分類される。
48,ウイルスによるシステムの機密性に対する脅威はどれか。解答記入欄( 55 )にマークしなさい。,通信速度が低下する。,ファイルやフォルダが削除される。,システムファイルやシステム領域が破壊される。,アプリケーションやデータファイルが損傷を受ける。,個人のデータファイル等がメールによって転送される。
49,システムのサーピス水準評価指標として正しいのはどれか。解答記入欄( 56 )にマークしなさい。,輻輳(ふくそう)回数,応答時間,CPU使用率,メモリ使用率,ディスク使用量
50,あるシステムの全運転時間が200時間で故障時間が30分の時、故障率はどれか。解答記入欄( 57 )にマークしなさい。,0.0025,0.05,0.15,0.85,0.9975
